{
  "formatVersion": "1.0",
  "registryId": "registry.gridmason.dev",
  "seq": 8,
  "issuedAt": 1704067200000,
  "ttlSeconds": 3600,
  "entries": [
    { "artifact": "acme-chart@1.2.3", "state": "revoked", "severity": "high", "reason": "CVE-2024-0001" },
    { "artifact": "acme-map@0.9.0", "state": "killed", "severity": "critical", "reason": "active exploitation" }
  ]
}
